Section,Institution,Type,Address,City,State,Zip,Latitude,Longitude,Enrollment,Campus Size,Suitability,Notes
Within,Saginaw Valley State University,Public University,"7400 Bay Road, University Center, MI 48710",University Center,MI,48710,43.521971,-83.974178,8500,748,,Large public university with extensive campus grounds and quad areas ideal for voter drives
Within,Delta College,Community College,"1961 Delta Road, University Center, MI 48710",University Center,MI,48710,43.552196,-83.977233,10000,640,,Major community college serving tri-cities area with multiple campus locations
Within,University of Michigan-Flint,Public University,"303 E Kearsley Street, Flint, MI 48502",Flint,MI,48502,43.019554,-83.68732,7500,76,,UM satellite campus in downtown Flint with modern facilities and gathering spaces
Within,Mott Community College,Community College,"1401 E Court Street, Flint, MI 48503",Flint,MI,48503,43.018581,-83.672835,6245,32,,Community college with main campus and multiple satellite locations throughout Genesee County
Within,Kettering University,Private University,"1700 University Avenue, Flint, MI 48504",Flint,MI,48504,43.013816,-83.714102,2030,85,,Private STEM-focused university with co-op program and campus quad areas
Within,Northwood University,Private University,"4000 Whiting Drive, Midland, MI 48640",Midland,MI,48640,43.630086,-84.276035,3800,434,,Private business-focused university with traditional campus and residence halls
Near,Central Michigan University,Public University,"1400 E Bellows Street, Mount Pleasant, MI 48859",Mount Pleasant,MI,48859,43.593748,-84.758106,17000,854,,Large public research university approximately 30 miles west of district boundary